{"generated_at":"2026-10-11T04:03:21Z","note":"k = 1..14, other params default. Series 'limit' sets max_open_sites = k (flat above the optimum's 8 sites); series 'exactly' also sets open_exactly (the mxo row is =). Infeasible k carry a relaxed record (relax = true) with the elastic report and words. Hauls are tons-weighted road-equivalent miles of the inbound and outbound legs.","schema_version":"v1","series":[{"id":"limit","label":"At most k sites open (max_open_sites = k)","records":[{"components":null,"cost_per_ton_usd":null,"haul_in_mi":null,"haul_out_mi":null,"k":1,"lp_text_sha256":"11e3bbaf3db3e5e329c7712541211993125118500be27f218f0a69170fad6ea9","objective_usd":null,"open_sites":[],"params":{"capacity_scale":1.0,"closed_lanes":[],"closed_sites":[],"demand_scale":1.0,"fixed_cost_scale":1.0,"fixed_open":null,"freight_scale":1.0,"max_open_sites":1,"open_exactly":false,"relax":false},"relaxed":{"components":{"fixed_usd":131760000.0,"handling_usd":33722083.0,"inbound_transport_usd":174698917.906,"outbound_transport_usd":253962932.95499998,"penalties_usd":{"capacity_overshoot":0.0,"open_sites_excess":120000000.0,"supply_overshoot":0.0,"unmet_demand":0.0}},"cost_per_ton_usd":275.7546,"haul_in_mi":605.439,"haul_out_mi":306.181,"lp_text_sha256":"f587faec25d3043d4a1af6e9428ad1bd6ccc778bf017c0e1529ba5ba88d37374","objective_usd":714143933.86,"open_sites":[0,1,2,3,11],"params":{"capacity_scale":1.0,"closed_lanes":[],"closed_sites":[],"demand_scale":1.0,"fixed_cost_scale":1.0,"fixed_open":null,"freight_scale":1.0,"max_open_sites":1,"open_exactly":false,"relax":true},"relaxation":{"capacity_overshoot":[],"open_sites_excess":4.0,"summary":"open-site limit exceeded by 4 site(s)","supply_overshoot":[],"total_penalty_usd":120000000.0,"unmet_demand":[],"words":["4 SITES MORE THAN THE LIMIT OF 1 WOULD HAVE TO OPEN."]},"routes_in":[[0,2,0,121235.0],[0,2,1,31775.0],[0,2,2,199501.0],[0,3,0,195353.0],[0,3,1,57308.0],[0,3,2,304789.0],[0,11,0,97608.0],[0,11,1,28053.0],[0,11,2,150938.0],[1,1,0,212634.0],[1,1,1,64341.0],[1,1,2,333307.0],[2,0,0,283809.0],[2,0,1,70816.0],[2,0,2,438314.0]],"routes_out":[[0,0,124796.0],[0,1,29091.0],[0,2,195028.0],[5,0,48588.0],[5,1,16690.0],[5,2,75677.0],[10,0,33766.0],[10,1,8785.0],[10,2,77163.0],[15,0,36185.0],[15,1,11189.0],[15,2,54421.0],[21,0,23356.0],[21,1,6147.0],[21,2,37233.0],[25,0,24896.0],[25,1,5132.0],[25,2,27422.0],[30,0,19857.0],[30,1,6689.0],[30,2,39984.0],[35,0,18999.0],[35,1,6043.0],[35,2,27873.0],[41,0,19230.0],[41,1,5450.0],[41,2,35310.0],[46,0,15176.0],[46,1,4064.0],[46,2,22888.0],[54,0,14655.0],[54,1,4429.0],[54,2,24781.0],[55,0,14099.0],[55,1,3387.0],[55,2,24594.0],[61,0,13191.0],[61,1,4051.0],[61,2,24703.0],[68,0,15612.0],[68,1,3379.0],[68,2,21946.0],[72,0,16285.0],[72,1,4215.0],[72,2,18283.0],[76,0,10363.0],[76,1,3180.0],[76,2,17164.0],[82,0,10172.0],[82,1,2970.0],[82,2,17725.0],[88,0,9958.0],[88,1,2756.0],[88,2,14688.0],[92,0,10834.0],[92,1,3363.0],[92,2,15959.0],[95,0,11218.0],[95,1,3044.0],[95,2,16200.0],[100,0,10072.0],[100,1,2393.0],[100,2,14388.0],[105,0,9302.0],[105,1,2439.0],[105,2,15222.0],[110,0,8994.0],[110,1,2701.0],[110,2,14768.0],[117,0,11134.0],[117,1,2602.0],[117,2,12656.0],[123,0,9877.0],[123,1,2149.0],[123,2,15381.0],[125,0,7371.0],[125,1,2278.0],[125,2,13615.0],[130,0,7144.0],[130,1,2091.0],[130,2,13517.0],[135,0,7746.0],[135,1,2486.0],[135,2,13495.0],[141,0,7396.0],[141,1,2156.0],[141,2,14156.0],[146,0,7405.0],[146,1,2552.0],[146,2,12054.0],[151,0,8582.0],[151,1,1985.0],[151,2,13560.0],[158,0,9232.0],[158,1,2119.0],[158,2,9981.0],[163,0,6018.0],[163,1,2287.0],[163,2,9974.0],[166,0,6021.0],[166,1,1945.0],[166,2,10974.0],[172,0,8085.0],[172,1,2017.0],[172,2,10603.0],[178,0,6561.0],[178,1,2137.0],[178,2,8710.0],[183,0,5698.0],[183,1,2233.0],[184,0,1683.0],[184,2,10974.0],[187,0,7633.0],[187,1,2003.0],[187,2,7499.0],[191,0,7457.0],[191,1,2208.0],[191,2,9040.0],[195,0,6419.0],[195,1,2466.0],[195,2,10326.0],[201,0,6940.0],[201,1,1823.0],[201,2,9255.0],[206,0,6741.0],[206,1,1718.0],[206,2,9576.0],[210,0,5689.0],[210,1,1537.0],[210,2,9525.0],[218,0,5715.0],[218,1,1842.0],[218,2,7928.0],[223,0,6060.0],[223,1,1540.0],[223,2,9813.0],[228,0,6332.0],[228,1,1543.0],[228,2,9610.0],[231,0,5036.0],[231,1,1487.0],[231,2,7402.0],[239,0,5561.0],[239,1,1703.0],[239,2,8927.0],[241,0,5450.0],[241,1,1411.0],[241,2,8044.0],[245,0,4366.0],[245,1,1523.0],[245,2,8023.0],[250,0,5400.0],[250,1,1563.0],[250,2,8752.0],[255,0,4602.0],[255,1,1354.0],[255,2,7364.0],[264,0,4676.0],[264,1,1294.0],[264,2,7923.0],[266,0,5808.0],[266,1,1080.0],[266,2,8271.0],[271,0,4220.0],[271,1,1364.0],[271,2,6631.0],[275,0,4943.0],[275,1,1209.0],[275,2,6937.0],[280,0,4563.0],[280,1,1516.0],[280,2,7612.0],[285,0,4178.0],[285,1,1312.0],[285,2,7557.0],[290,0,3906.0],[290,1,1264.0],[290,2,6424.0],[295,0,4011.0],[295,1,1273.0],[295,2,5832.0],[300,0,5302.0],[300,1,1120.0],[300,2,7810.0],[307,0,4209.0],[307,1,1333.0],[307,2,6956.0],[310,0,4457.0],[310,1,1272.0],[310,2,7245.0],[316,0,4755.0],[316,1,1381.0],[316,2,7381.0],[321,0,4066.0],[321,1,1628.0],[321,2,7345.0],[325,0,4097.0],[325,1,1060.0],[325,2,5438.0],[333,0,4070.0],[333,1,1153.0],[333,2,6654.0],[335,0,4817.0],[335,1,967.0],[335,2,5635.0],[341,0,3741.0],[341,1,1212.0],[341,2,5442.0],[346,0,4494.0],[346,1,1315.0],[346,2,6982.0],[350,0,4256.0],[350,1,1328.0],[350,2,5970.0],[356,0,4089.0],[356,1,1112.0],[356,2,6153.0],[361,0,3869.0],[361,1,1038.0],[361,2,5897.0],[366,0,4676.0],[366,1,824.0],[366,2,5120.0],[370,0,3786.0],[370,1,1099.0],[370,2,5275.0],[375,0,3928.0],[375,1,1094.0],[375,2,4753.0],[380,0,3848.0],[380,1,1050.0],[380,2,7341.0],[386,0,4281.0],[386,1,1230.0],[386,2,5010.0],[390,0,3754.0],[390,1,956.0],[390,2,7860.0],[399,0,3998.0],[399,1,1384.0],[399,2,5325.0],[403,0,5289.0],[403,1,1080.0],[403,2,5907.0],[405,0,4506.0],[405,1,1065.0],[405,2,4931.0],[411,0,3498.0],[411,1,1008.0],[411,2,5154.0],[417,0,4029.0],[417,1,885.0],[417,2,7952.0],[421,0,3439.0],[421,1,1013.0],[421,2,6816.0],[426,0,3219.0],[426,1,1204.0],[426,2,4575.0],[431,0,3726.0],[431,1,1211.0],[431,2,5970.0],[436,0,2869.0],[436,1,852.0],[436,2,4931.0],[443,0,4186.0],[443,1,867.0],[443,2,5650.0],[446,0,3112.0],[446,1,938.0],[446,2,5819.0],[451,0,3814.0],[451,1,941.0],[451,2,4816.0],[458,0,3343.0],[458,1,1148.0],[458,2,5538.0],[461,0,2902.0],[461,1,821.0],[461,2,5386.0],[468,0,4406.0],[468,1,1026.0],[468,2,6133.0],[471,0,3563.0],[471,1,960.0],[471,2,5336.0],[478,0,3745.0],[478,1,1043.0],[479,2,5164.0],[483,0,2707.0],[483,1,975.0],[483,2,5303.0],[487,0,3260.0],[487,1,894.0],[487,2,5692.0],[490,0,2863.0],[490,1,1131.0],[490,2,4487.0],[496,0,2407.0],[496,1,1018.0],[496,2,4356.0]],"service_level":1.0,"status":"Optimal"},"routes_in":[],"routes_out":[],"status":"Infeasible"},{"components":null,"cost_per_ton_usd":null,"haul_in_mi":null,"haul_out_mi":null,"k":2,"lp_text_sha256":"1d3db52df914ce129e8896378587f111da5b3fb9f92b349271fd6ea2d95b4836","objective_usd":null,"open_sites":[],"params":{"capacity_scale":1.0,"closed_lanes":[],"closed_sites":[],"demand_scale":1.0,"fixed_cost_scale":1.0,"fixed_open":null,"freight_scale":1.0,"max_open_sites":2,"open_exactly":false,"relax":false},"relaxed":{"components":{"fixed_usd":131760000.0,"handling_usd":33722083.0,"inbound_transport_usd":174698917.906,"outbound_transport_usd":253962932.955,"penalties_usd":{"capacity_overshoot":0.0,"open_sites_excess":90000000.0,"supply_overshoot":0.0,"unmet_demand":0.0}},"cost_per_ton_usd":264.1706,"haul_in_mi":605.439,"haul_out_mi":306.181,"lp_text_sha256":"4aa957e681dce3f8c34b86d1e8431ab74a57eabcfcae2b3c721d3c5c33c7f0a2","objective_usd":684143933.86,"open_sites":[0,1,2,3,11],"params":{"capacity_scale":1.0,"closed_lanes":[],"closed_sites":[],"demand_scale":1.0,"fixed_cost_scale":1.0,"fixed_open":null,"freight_scale":1.0,"max_open_sites":2,"open_exactly":false,"relax":true},"relaxation":{"capacity_overshoot":[],"open_sites_excess":3.0,"summary":"open-site limit exceeded by 3 site(s)","supply_overshoot":[],"total_penalty_usd":90000000.0,"unmet_demand":[],"words":["3 SITES MORE THAN THE LIMIT OF 2 WOULD HAVE TO OPEN."]},"routes_in":[[0,2,0,121235.0],[0,2,1,31775.0],[0,2,2,199501.0],[0,3,0,195353.0],[0,3,1,57308.0],[0,3,2,304789.0],[0,11,0,97608.0],[0,11,1,28053.0],[0,11,2,150938.0],[1,1,0,212634.0],[1,1,1,64341.0],[1,1,2,333307.0],[2,0,0,283809.0],[2,0,1,70816.0],[2,0,2,438314.0]],"routes_out":[[0,0,124796.0],[0,1,29091.0],[0,2,195028.0],[5,0,48588.0],[5,1,16690.0],[5,2,75677.0],[10,0,33766.0],[10,1,8785.0],[10,2,77163.0],[15,0,36185.0],[15,1,11189.0],[15,2,54421.0],[21,0,23356.0],[21,1,6147.0],[21,2,37233.0],[25,0,24896.0],[25,1,5132.0],[25,2,27422.0],[30,0,19857.0],[30,1,6689.0],[30,2,39984.0],[35,0,18999.0],[35,1,6043.0],[35,2,27873.0],[41,0,19230.0],[41,1,5450.0],[41,2,35310.0],[46,0,15176.0],[46,1,4064.0],[46,2,22888.0],[54,0,14655.0],[54,1,4429.0],[54,2,24781.0],[55,0,14099.0],[55,1,3387.0],[55,2,24594.0],[61,0,13191.0],[61,1,4051.0],[61,2,24703.0],[68,0,15612.0],[68,1,3379.0],[68,2,21946.0],[72,0,16285.0],[72,1,4215.0],[72,2,18283.0],[76,0,10363.0],[76,1,3180.0],[76,2,17164.0],[82,0,10172.0],[82,1,2970.0],[82,2,17725.0],[88,0,9958.0],[88,1,2756.0],[88,2,14688.0],[92,0,10834.0],[92,1,3363.0],[92,2,15959.0],[95,0,11218.0],[95,1,3044.0],[95,2,16200.0],[100,0,10072.0],[100,1,2393.0],[100,2,14388.0],[105,0,9302.0],[105,1,2439.0],[105,2,15222.0],[110,0,8994.0],[110,1,2701.0],[110,2,14768.0],[117,0,11134.0],[117,1,2602.0],[117,2,12656.0],[123,0,9877.0],[123,1,2149.0],[123,2,15381.0],[125,0,7371.0],[125,1,2278.0],[125,2,13615.0],[130,0,7144.0],[130,1,2091.0],[130,2,13517.0],[135,0,7746.0],[135,1,2486.0],[135,2,13495.0],[141,0,7396.0],[141,1,2156.0],[141,2,14156.0],[146,0,7405.0],[146,1,2552.0],[146,2,12054.0],[151,0,8582.0],[151,1,1985.0],[151,2,13560.0],[158,0,9232.0],[158,1,2119.0],[158,2,9981.0],[163,0,6018.0],[163,1,2287.0],[163,2,9974.0],[166,0,6021.0],[166,1,1945.0],[166,2,10974.0],[172,0,8085.0],[172,1,2017.0],[172,2,10603.0],[178,0,6561.0],[178,1,2137.0],[178,2,8710.0],[183,0,5698.0],[183,1,2233.0],[184,0,1683.0],[184,2,10974.0]